{
  "kind": "diamond.state_event.v0",
  "diamond_id": "diamond:old123",
  "previous_state": "current",
  "new_state": "superseded",
  "mode": "supersede",
  "reason": "Newer candidate exists",
  "evidence_refs": ["diamond:new123"],
  "successor_diamond_id": "diamond:new123",
  "successor_manifest_path": "/tmp/new/diamond_manifest.json",
  "authority_id": "dan",
  "state_event_hash": "diamond-state-event:abc123",
  "state_event_path": "/tmp/state_event.json",
  "created_at": "2026-07-02T12:00:00Z"
}
